<?xml version="1.0" encoding="utf-8"?> <collection_policy xmlns="http://www.islandora.ca" xmlns:xsi="http://www.w3.org/2001/XMLSchema-instance" name="" xsi:schemaLocation="http://www.islandora.ca http://syn.lib.umanitoba.ca/collection_policy.xsd"> <content_models> <content_model name="STANDARD_JPEG" dsid="ISLANDORACM" namespace="demo:Smiley" pid="demo:DualResImage"/> </content_models> <search_terms> <term field="dc.title">dc.title</term> <term field="dc.creator">dc.creator</term> <term field="dc.description" default="true">dc.description</term> <term field="dc.date">dc.date</term> <term field="dc.identifier">dc.identifier</term> <term field="dc.language">dc.language</term> <term field="dc.publisher">dc.publisher</term> <term field="dc.rights">dc.rights</term> <term field="dc.subject">dc.subject</term> <term field="dc.relation">dc.relation</term> <term field="dcterms.temporal">dcterms.temporal</term> <term field="dcterms.spatial">dcterms.spatial</term> <term field="fgs.DS.first.text">Full Text</term> </search_terms> <relationship>isMemberOf</relationship> </collection_policy>